{"$schema":"https://json-schema.org/draft/2020-12/schema","type":"object","required":["case_id","claim_layer","family","provider_contract","subject_adapter","stimulus","limit","expected"],"properties":{"case_id":{"type":"string","minLength":1},"claim_layer":{"type":"string","minLength":1},"family":{"const":"resource-exhaustion"},"provider_contract":{"type":"string","minLength":1},"subject_adapter":{"type":"string","minLength":1},"stimulus":{"type":"object","required":["operation"],"properties":{"operation":{"type":"string","minLength":1}},"additionalProperties":false},"limit":{"type":"object","required":["kind","maximum","requested"],"properties":{"kind":{"const":"execution-steps"},"maximum":{"type":"integer","minimum":1},"requested":{"type":"integer","minimum":1}},"additionalProperties":false},"expected":{"type":"object","required":["failure_code"],"properties":{"failure_code":{"const":"resource-limit"}},"additionalProperties":false}},"additionalProperties":false}
