{"case_id":"artifact-integrity-resource-exhaustion","claim_layer":"artifact-integrity","family":"resource-exhaustion","provider_contract":"pigloros.fixture.artifact-integrity@1.0.0","subject_adapter":"exported-artifact","stimulus":{"operation":"consume-execution-steps"},"limit":{"kind":"execution-steps","maximum":10000000,"requested":10000001},"expected":{"failure_code":"resource-limit"}}
