{"case_id":"knowledge-non-interference-resource-exhaustion","claim_layer":"knowledge-non-interference","family":"resource-exhaustion","provider_contract":"pigloros.fixture.knowledge-non-interference@1.0.0","subject_adapter":"exported-artifact","stimulus":{"operation":"consume-execution-steps"},"limit":{"kind":"execution-steps","maximum":10000000,"requested":10000001},"expected":{"failure_code":"resource-limit"}}
